105,Hostel 4,"Currently part of the product team at OYO, prior to my current role I was part of the strategy team at OYO. Before making the swith OYO, I had joined BCG from campus.",OYO Rooms,Product Manager,2017,Bachelor of Technology - B.Tech.,India,Chemical Engineering,Management consulting,2,0,1,0
106,Hostel 12,Making core thermal power plants more efficient. Business lead to Modernize power plants. Digitalization of power plants with embedded Artificial Intelligence and Machine Learning,Siemens Limited,Chief Manager,2005,Master of Technology - M.Tech.,India,Energy Science & Engineering,Analytics,2,0,1,0
107,Hostel 10,"Strategic IT Project Manager with 4 years of work experience, I worked as an Assistant General Manager in Vodafone Idea Limited, where I lead MIS consolidation and migration projects from a delivery perspective.Currently pursuing my PGP in IIM Bangalore",Vodafone Idea Limited,Assistant General Manager,2017,Bachelor of Technology - B.Tech.,India,Chemical Engineering,IT,3,0,1,0
108,Hostel 7,"Working with Manufacturing customer in areas of Machine manufacturing, Industrial chemicals and coatings, Automotive and Aero tier1, in areas of IT consulting, process improvement and ERP implementations",TCS,Delivery Partner,2004,Master of Management - M.M. / M.Mgt. / M.Mgmt.,India,Shailesh J. Mehta School of Management,IT,1,0,1,0
109,Hostel 2,I am working in the private equity sector. Part of the team at Blackstone India focused on making control-oriented investments in businesses based in India.,Blackstone,Associate,2017,Bachelor of Technology - B.Tech.,India,Mechanical Engineering,Finance,2,0,1,0
110,Hostel 12,"Ex-Associate at JP Morgan & Chase. Decision Analytics, Resource Planning and Optimization. An Operations Research and Analytics Professional with over 5+ years of versatile experience in domains of Banking, Aviation, Supply Chain, Logistics and Manufacturing Industries in taking Mathematics driven Business Decisions. Specialities : Linear & Mixed Integer Programming, Large Scale Optimization, Queueing Theory, Machine Learning. Technology : Ilog Cplex OPL Studio and Concert with Java C++, Python, SAS, SQL, R, VBA, Advanced Excel.",Tata Insights & Quants,Manager,2012,Master of Technology - M.Tech.,India,Industrial Engineering & Operations Research - I.E.O.R.,Analytics,1,0,1,0
111,Hostel 1,"Leading Team, Strategy and roadmap management, Delivery of automation solution on Big data Hadoop, Machine Learning solutions, Al solutions delivery",Barclays Technology Center India,Associate Vice-President,2005,Master of Technology - M.Tech.,India,Energy Science & Engineering,Management,3,0,1,0
112,Hostel 2,"I've been working in Financial services across Investment Banking (Credit Suisse, Goldman Sachs) and Fintech (InCred, Visa). In my current role, I head Consumer Credit Products for Visa India and South Asia",Visa Inc,Associate Director,2010,Bachelor of Technology - B.Tech.,India,Aerospace Engineering,Finance,3,0,1,0
113,Hostel 1,"Responsible for conceptualizing, establishing and growing the business of plasma products for one of the leading Biopharmaceutical companies of India.",PlasmaGen BioSciences,CEO,1994,Doctor of Philosophy - Ph.D. / D.Phil.,India,Biosciences & Bioengineering,Strategy consulting,1,0,1,0
114,Hostel 13,"I am an Indian Administrative Service (IAS) officer of 2016 batch. Bihar Cadre. I am looking after public administration of the district (Vaishali, Bihar) in general, and development administration to be specific.",Government of Bihar,"Deputy Development Commissioner cum Chief Executive Officer, Zila Parishad",2010,Bachelor of Technology - B.Tech.,India,Metallurgical Engineering & Materials Science,Civil Services/Govt. of,3,0,1,0
115,Hostel 12,"Working in R-&D- Chassis Design at Ola Electric.8 years experience in R&D, worked for design of chassis of Land Rover's Discovery sports and Hero's Maestro Edge, Duet Auto- 2&4 wheeler R&D. Chassis design in Tata Motors and Hero Motocorp Ltd",Ola Electric LTD,SENIOR MANAGER,2009,Master of Technology - M.Tech.,India,Mechanical Engineering,Design,3,0,1,0
116,Hostel 11,"I have enjoyed working in automotive, IT and educational domains in different capacities - technology, innovation, project management, business development and strategy.",Vodafone Idea,Assistant General Manager,2010,Master of Technology - M.Tech.,India,Systems & Control Engineering,Other,2,0,1,0
117,Hostel 13,"Over 17 years of rich work experience in the field of data science, advanced analytics, machine learning, FinTech, Platform and Cloud based data solution. Other activities include data science competency development, academic collaboration",Wipro Ltd,"Consulting Partner - Data, Analytics and Artificial Intelligence",2004,Master of Science - M.Sc. / S.M.,United Kingdom,Mathematics,Analytics,4,0,1,0
118,Hostel 5,"Ex-Project leader at Boston consulting group (BCG). Experience in strategy (BCG), investments (IFC), banking (JP Morgan), and Policy (Office of Mr. NarendraModi)",TVS Motor,General Manager,2010,Dual Degree - B. Tech. & M. Tech.,India,Electrical Engineering,Management consulting,4,0,1,0
119,Hostel 13,"will fill


",NA,NA,2007,Bachelor of Technology - B.Tech.,India,Chemical Engineering,Core engineering,2,0,1,0
120,Hostel 4,I have been working with the IT Industry for over 2 decades. Have worked both in India and abroad in the Silicon valley. Have worked with Silicon Valley startups and Indian IT Majors as well.,Infosys,Principal Consultant,1994,Bachelor of Technology - B.Tech.,India,Chemical Engineering,IT,1,0,1,0
121,Hostel 8,"Lead data engineering, data science and data analytics teams for Earnest. We are a fintech company focused on online lending to financially responsible borrowers.",Earnest,Director,2010,Bachelor of Technology - B.Tech.,India,Aerospace Engineering,Finance,2,0,1,0
122,Hostel 4,"I run a startup company which builds software for sports instructors. Prior experience includes sales and trading in commodities and equities, as well as product development and account management in the semiconductor equipment industry.",QSchool Sports LLC,Founder and CEO,1995,Dual Degree - B. Tech. & M. Tech.,United States,Chemical Engineering,Finance,2,0,1,0
123,Hostel 2,"He was CEO of MyKYCBank.  He was also Vice President at Rosy Blue. Focussed on helping Top Management identify and address real business challenges
Areas of work include - Industry Analysis and Forecasting",Pharos Beam Consulting LLP,Partner,1994,Bachelor of Technology - B.Tech.,India,Chemical Engineering,Management consulting,2,0,1,0
124,Hostel 10,"Working in strategy at Founder's office in GOAT Brand Labs, a D2C brands e-comm roll up venture. Worked at McKinsey as Consultant prior to this and completed MBA from IIM Ahmedabad",GOAT Brand Labs,"Strategy, Founder's Office",2018,Dual Degree - B. Tech. & M. Tech.,India,Energy Science & Engineering,Management,1,0,1,0
125,Hostel 3,"Currently handle a $200M business for Infosys BPOM Ltd. Areas of experience and expertise include IT and allied services across sales, solutions and operations. Been playing a senior management role for the last 10 years.",Infosys bpm ltd,Vice President,1994,Bachelor of Technology - B.Tech.,India,Mechanical Engineering,Management consulting,2,0,1,0
126,Hostel 5,I am currently working in the Strategy & NPI team for the Abbott Nutrition International - India Affiliate. I have worked in the Sales Force Effectiveness & Project Management Office of the Specialty Care business in Abbott Healthcare Pvt. Ltd. and as an analyst in Kearney (formerly known as A. T. Kearney).,Abbott,Sr. Manager,2016,Bachelor of Technology - B.Tech.,India,Chemical Engineering,Strategy consulting,2,0,1,0
127,Hostel 2,"Currently heading the IoT group at GS Lab, providing end-to-end solutions to various industry verticals. Before that, founded ConnViva Tech and led a multi-disciplinary team developing and implementing IoT solutions for animal husbandry sector, manufacturing & process industries, supply chain etc. Previously, a Process Engineer and Materials Scientist: - An integral part of the 5-member team which developed View Inc.'s pioneering electrochromic (EC) technology and scaled it up to produce high-volume architectural EC glass. - Expert in design-execution-analysis of experiments for process development of diverse materials systems like thin films and aerogels. - Self-starter in a fast-paced environment: Played a key role in high-impact, direction-altering projects.",GS Lab,Director of Engineering,2006,Bachelor of Technology - B.Tech.,India,Metallurgical Engineering & Materials Science,Core engineering,2,0,1,0
128,Hostel 7,"I am working as a Project Engineer in energy sector. I manage projects in Offshore wind industry and coordinate with various package managers of turbine suppliers, foundation suppliers etc. and work with contracts and procurement to deliver the project.",Royal Dutch Shell,Project Engineer,2013,Bachelor of Technology - B.Tech.,India,Mechanical Engineering,Management,2,0,1,0
129,Hostel 12,"Graphics hardware front-end design. Expert in Graphics Architecture, design and verification in VLSI domain. 15 years of experience in Intel graphics domain and worked on multiple generation of Internal and discrete Graphics SOC with muti billon $ revenue.",Intel,Design Manager,2006,Master of Technology - M.Tech.,India,Electrical Engineering,Core engineering,1,0,1,0
130,Hostel 9,Senior Staff Engineer at Qualcomm Inc. Works in VLSI Design. VLSI Design. Have 15+ years of experience in working for Semiconductor manufacturing companies.,Qualcomm India Pvt Ltd,Staff Program Manager,2001,Master of Technology - M.Tech.,India,Electrical Engineering,Core engineering,4,0,1,0
131,Hostel 1,"""Head Technology Mgmt Mahindra; Vice president R&D , Innovation , Thermax; Chief R&D, Forbes Marshall; Thermal Egg, R&D, Innovation, Technology, Energy, Heat Exchangers, Knowledge Mgmt. """,MAITRI,Founder MAITRI,1974,Master of Technology - M.Tech.,India,Mechanical Engineering,Core engineering,2,0,1,0
132,Hostel 4,"Wide experience in Instrumentation industry (Computers, networks, communication, electronics, electricals, software) in India and abroad, at site and in office. Engineering and administrative.",(own consultancy),Consultant,1984,Bachelor of Technology - B.Tech.,India,Electrical Engineering,Core engineering,2,0,1,0
133,Hostel 7,"I work at Institute of Oil and Gad Production Technology, an R&D institute of ONGC at Panvel, Navi Mumbai. My work involves basic and applied research in Well Stimulation and Well Completion",ONGC Limited,Executive Engineer (Production),2014,Dual Degree - B. Tech. & M. Tech.,India,Mechanical Engineering,Core engineering,2,0,1,0
134,Hostel 7,"Over 42 years experience in Steel-making and processing industry including electric furnace steel-making, continuous casting hot and cold rolling of flat and long steel products, covering manufacturing, quality control and assurance, product developm",N.A.,Retired,1971,Bachelor of Technology - B.Tech.,India,Metallurgical Engineering & Materials Science,Core engineering,2,0,1,0
135,Hostel 9,"Strategy, Operations and Finance for the Hero Enterprise along with supporting the organic and inorganic growth of the group companies; Focuses on diverse expansion and growth programmes of the Hero Group.",Hero Group,Strategic Planning & Projects,2014,Dual Degree - B. Tech. & M. Tech.,India,Metallurgical Engineering & Materials Science,Strategy consulting,2,0,1,0
136,Hostel 13,"Head Digital Excellence at Boehringer Ingelheim.An innovative and organized professional with work experience across different industries. Key strengths include:
 - Forging partnerships with different internal and external stakeholders
 - Studying user behavior and adapting platforms to end user needs. etc",Boehringer Ingelheim,Head Digital Excellence,2010,Master of Management - M.M. / M.Mgt. / M.Mgmt.,India,Shailesh J. Mehta School of Management,Management,2,0,1,0
137,Hostel 2,"Currently a consultant, previously the Chief Product Officer at a fintech startup, cofounder at a digital manufacturing & a water desalination startup and an investment banking analyst.",Think North,Founder,2014,Bachelor of Technology - B.Tech.,India,Metallurgical Engineering & Materials Science,Strategy consulting,4,0,1,0
138,Hostel 13,"I'm working in leading Semiconductor Industry on advanced technology nodes via 16nm, 10nm, 7nm, 5nm, 3nm technology and GAA devices.",TSMC,Process Development Engineer,2014,Master of Technology - M.Tech.,India,Metallurgical Engineering & Materials Science,Research,3,0,1,0
139,Hostel 6,"Worked as Sales Professional at IBM India Pvt. Ltd.Worked with Flipkart in Social Media Marketing during autumn internship at SPJIMR.
 Before MBA, worked at Monnet Ispat & Energy Limited as Assistant Manager, Sales and Marketing in Delhi and Maharashtra region for 19 months.",EY,AVP,2012,Bachelor of Technology - B.Tech.,India,Metallurgical Engineering & Materials Science,Management consulting,1,0,1,0
140,Hostel 6,"I have worked in Pharma and Polymer Industry for 5.7 yrs as Scientist and shifted to Intellectual Property Rights and currently working in this field since Oct 2006.
 Always excited to work in an environment where intellectual property is considered as a tool to generate revenues for businesses and not juts an enforcement tool.",Momentive,Senior Scientist,1995,Master of Science - M.Sc. / S.M.,India,Chemistry,Research,2,0,1,0
141,QIP,"Delivering talks on special topics of holistic development, change management, regulation of mind and experience meditation. Counseling youth on communication skills, character development, regulation of mind through practice of meditation.","Visiting faculty Mech engg, holistic development",Retired Professor in Thermal engg/ Retired Principal,2007,Doctor of Philosophy - Ph.D. / D.Phil.,India,Energy Science & Engineering,Research,4,0,1,0
142,Hostel 7,Mathisys Advisors is a quantitative trading firm with focus on high & medium frequency trading in various asset classes across the globe. I have been leading the technology team in the firm.,Mathisys Advisors LLC,CTO,1988,Bachelor of Technology - B.Tech.,India,Electrical Engineering,Core engineering,2,0,1,0
143,Hostel 6,Working in the fields of business and data analytics at Uber.Ex-Senior Analyst at Fractal Analytics. Former Business and Data Analyst at Philips Lighting ltd.,Uber Ltd.,Risk Analyst,2014,Bachelor of Technology - B.Tech.,India,Metallurgical Engineering & Materials Science,Analytics,2,0,1,0
144,Hostel 4,"My experience till date in Shell have been in the field of Project Management and digital transformation. This included delivering engineering for oil extraction and refining projects, working in projects during construction in a refinery managing the contractors, managing engineering and leading the programs to digitalize the project management and production asset space.",Royal Dutch Shell,Digital Project Engineer,2015,Dual Degree - B. Tech. & M. Tech.,India,Chemical Engineering,Core engineering,2,0,1,0
145,Hostel 10,"Barkha Bansal (https://www.linkedin.com/in/barkha-b/) -3 mos Pre-MBA Internship, Investment Team @ Blume Ventures Full-time -2 yrs 10 mos Co-Founder, Head of Business Development @ PV Diagnostics -9 mos Investment Associate @ Guild Capital -1 yr 8 mos Associate Consultant @ Bain & Company -1 yr 1 mo Founder @ Abhyuday IIT Bombay -Master of Business Administration - MBA @ INSEAD -Bachelor + Master (Integrated Dual Degree) @ Indian Institute of Technology, Bombay",INSEAD,MBA Student at INSEAD,2015,Dual Degree - B. Tech. & M. Tech.,France,Energy Science & Engineering,Strategy consulting,1,0,1,0
146,Hostel 12,"Experienced Technology Specialist with a demonstrated history of working in the Engineering Analysis industry. Strong professional skilled in CFD, Heat Transfer, Turbomachinery, Aerodynamics and FluidStructure Interaction.",Siemens Energy,Manager,2009,Master of Technology - M.Tech.,India,Aerospace Engineering,Core engineering,2,0,1,0
147,Hostel 1,"Intelligent Transporatation Systems, Smart Cities, Traffic Engineering, Toll Road Studies, Revenue Management Systems, Infrastruture Investment Assessments, Data Analytics etc.,",IBI Group,Director,2000,Master of Technology - M.Tech.,India,Civil Engineering,Management consulting,1,0,1,0
148,Hostel 7,"I'm currently working as a Vice President of Research at WorldQuant. I work majorly in the domain of Quantitative Finance and Algorithmic Trading. Statistics, Machine Learning, Optimization are some of the skills required in this area. Previously, I've interned at Adobe Research and Tata Research during my graduation, published research papers in Deep Learning. I was also an ISMP mentor for two years during my stay at IITB.",WorldQuant,Vice President,2018,Dual Degree - B. Tech. & M. Tech.,India,Electrical Engineering,Finance,2,0,1,0
149,QIP,"Asst. General Manager at Volvo India Pvt Ltd. Automotive Electrical and Electronics and Telematics. Worked at Force Motors and Mahindra & Mahindra previously. Over two decades of work experience in design and development of automotive Electrical and Electronics systems, Embedded Control Systems, Telematics system, In vehicle diagnostic and remote diagnostics by Vehicle heath monitoring, Setting of engine and component test labs, analytics and Project and program Management for varied businesses",UD TRUCKS,AGM,2007,Master of Technology - M.Tech.,India,Electrical Engineering,Core engineering,1,0,1,0
150,Hostel 4,"Setup outsourcing strategy, captive centre in India, and worked closely with global CIOs and his directs of Credit Suisse. Managed large scale IT projects. Currently consulting small and mid sized companies on setting up offices and business in Euro",Independent Consultant (Past Credit Suisse as Director IT),Advisor (Independent Consultant),1990,Master of Technology - M.Tech.,India,Shailesh J. Mehta School of Management,Management,2,0,1,0
151,Hostel 4,I am responsible for the global commercial delivery of the plant based proteins by business unit for Ingredion Incorporated. This includes marketing and revenue delivery. Previous experience includes a variety of R&D and business development roles,Ingredion incorporated,"Director, business development",1994,Bachelor of Technology - B.Tech.,United States,Chemical Engineering,Core engineering,1,0,1,0
152,Hostel 14,"UX Design, Design Research, Design Entrepreneurship, Architecture, Industrial Design, Pet Foods & Veterinary healthcare, Karate / Martial Arts, Fitness, Bamboo, Real Estate, BFSI, HealthCare Tech, Remote collaboration in Design / Tech, Design Education. For details please check Linkedin profile.",Atlassian,Lead Designer,2012,Master of Design - M.Des. / M.Design,India,Industrial Design Centre,Design,2,0,1,0
153,Hostel 6,I work with startups and couple of investors in providing advisory services to young entrepreneurs.I specilize in strategic analysis of businesses and help develop key differentiators. I also assist startups reach out to potential customers.,A2A Training & Mentoring LLP,Founder & CEO,1992,Bachelor of Technology - B.Tech.,India,Chemical Engineering,Management consulting,2,0,1,0
154,Hostel 8,Will Fill,Freelancer,Freelancer,1984,Bachelor of Technology - B.Tech.,India,Civil Engineering,Other,1,0,1,0
155,Hostel 5,"Currently, working in a Swiss Med-Tech startup. Hold a masters degree in Mech Eng from Imperial College London. Personal Website: https://akshay-raut.webnode.com/",Sleepiz AG,Lead R&D Engineer,2018,Bachelor of Technology - B.Tech.,India,Mechanical Engineering,Research,2,0,1,0
156,Hostel 8,"Provide consultancy for improving business processes and overall performance. 17 years of experience in supply chain operations, production, quality, project management in the manufacturing sector. Worked in Project Management, Application Development for the last 17 years.",Vainateya Software consultancy Pvt Ltd,CEO & Technical Director,1973,Bachelor of Technology - B.Tech.,India,Metallurgical Engineering & Materials Science,Management consulting,2,0,1,0
157,Hostel 9,"Working in FinTech industry as an implementation consultant and manage risk product suite. Products cater to capital markets of Banks, NBFCs for trading, risk management and settlement.",Finmechanics India Pvt Ltd,Senior Consultant,2017,Bachelor of Technology - B.Tech.,India,Metallurgical Engineering & Materials Science,Finance,2,0,1,0
158,Hostel 8,"Bioengineer specialising in orthopaedic biomechanics, with specific focus on upper-limb and lower-limb joints. Completed my DD in Mech from IITB, MSc and PhD in Bioengineering from Imperial College London, and Postdoctoral research from KU Leuven, Be",IIT Bombay,Assistant Professor,2012,Dual Degree - B. Tech. & M. Tech.,India,Mechanical Engineering,Research,4,0,1,0
159,Hostel 4,"Currently leading Data Science at Navi Technologies, the latest venture of Sachin Bansal (ex-Flipkart CEO) in financial services domain. Prior to this, I have worked in leading fintech startups (Avail Finance and ZestMoney) as well as at Citibank in",Navi Technologies,Senior Data Scientist,2015,Dual Degree - B. Tech. & M. Tech.,India,Metallurgical Engineering & Materials Science,Analytics,2,0,1,0
160,Hostel 13,Working in Program Management at Jubliant Foodworks. Ex-Program Manager at Ernst and Young.Former PM in IBM.Worked as a consultant in Feedback Infra.,Jubilant Foodworks,Senior Manager - Business Excellence,2010,Master of Management - M.M. / M.Mgt. / M.Mgmt.,India,Shailesh J. Mehta School of Management,Management,2,0,1,0
161,Hostel 6,"Over 35 years experience in R&D and teaching covering aspects of computer science, microelectronics, VLSI architectures, embedded systems, hardware-software codesign, etc.",Retired,Retired,1986,Master of Technology - M.Tech.,India,Computer Science & Engineering,Research,2,0,1,0
162,Hostel 6,"Responsible for collecting amount lent to customers. Working closely with analytics, technology, communications, user experience and customer operations team.",Gain Credit,Manager Collections Data Science,2016,Master of Science - M.Sc. / S.M.,India,Mathematics,Analytics,2,0,1,0
163,Hostel 9,"Management, Startups, Computer Science. Total number of years is 35 in the US where I worked with NASA, IBM and University of Texas @ Austin. My company has been awarded the award for Excellence in Education by Govt. of India in 2016 and it has been",Magnificient2 Software Services & Technologies Inc,CEO,1980,Master of Technology - M.Tech.,India,Centre for Environmental Science & Engineering - CESE,IT,3,0,1,0
164,Hostel 6,"Working as a associate in a major Consulting firm.Ex-Associate at CHAI. Former Manger with Grail Research (ex-Monitor Group) and has worked across a wide variety of industries such as Consumer Goods, Retail, Technology, and Telecom.Did MBA from IIM Ahmedabad",The Global Fund,Associate,2009,Bachelor of Technology - B.Tech.,Switzerland,Civil Engineering,Management consulting,3,0,1,0
165,Hostel 7,"Past work: 1) CRISIL - Strategic Advisory in Infrastructure Sector - dealing with World bank, ADB, national and international government organisation to propel growth and development of the region 2) Start up in the Maritime Logistics Space",Shell,Deals Advisor,2014,Bachelor of Technology - B.Tech.,India,Civil Engineering,Finance,3,0,1,0
166,Hostel 1,"Independent Consultant in IT and Telecom space. Prior to working as a consultant, Mr. Ramadas served as Chief Technology Officer and Vice President at HCL Technologies BPO Services. Responsible for strategic decisions in setting up and managing large data and voice global networks",HCL Technologies,Senior consultant IT and telecom,1971,Master of Technology - M.Tech.,India,Electrical Engineering,IT,1,0,1,0
167,Hostel 4,"Setup outsourcing strategy, captive centre in India, and worked closely with global CIOs and his directs of Credit Suisse. Managed large scale IT projects. Currently consulting small and mid sized companies on setting up offices and business in Euro",Independent Consultant,Independent consultant. Was Director IT for Credit Suisse in past.,1990,Master of Technology - M.Tech.,India,Shailesh J. Mehta School of Management,Management,2,0,1,0
168,Hostel 6,"Business Development Cooling - East Asia and Pacific,APC by Schneider Electric,Mumbai.Former General Manager - Product Management & Application Engineering at Uniflair India Pvt. Ltd. Former Sr. Manager at Tecumseh Products Company.",Schneider Electric,Director,1997,Master of Technology - M.Tech.,India,Mechanical Engineering,Core engineering,2,0,1,0
169,Hostel 3,"I am a consultant assisting Indian and Overseas SMEs in development of Business strategy to work together for mutual benefits in Buying , Selling , Technological up-gradation , Market Research , Joint Ventures and Acquisitions",LCB Sourcing,Partner,1970,Bachelor of Technology - B.Tech.,India,Mechanical Engineering,Strategy consulting,3,0,1,0
170,Hostel 1,Director ofMega Zing Solutions Pvt. Ltd.(MZSPL offer research & consulting services in Energy & Water Sector and Climate Change Adaptation and Mitigation).Former Principal Invetigator at USAID.has worked with the Global Deloitte Team.,Mega Zing Solutions Pvt. Ltd.,Director,2005,Doctor of Philosophy - Ph.D. / D.Phil.,India,Energy Science & Engineering,Research,1,0,1,0
171,Hostel 6,"-Strategy Consulting for Corporate entities and PE Funds across 3 continents on strategic issues involving new investments, dealing with competitive pressures, exploitation of outsourcing opportunities, envisioning the future of the industries with a view to take leadership positions, etc.",Avalon Group,Chairman,1971,Bachelor of Technology - B.Tech.,India,Metallurgical Engineering & Materials Science,Management,2,0,1,0
