172,Hostel 10," She was a Postdoctoral Associate at University of Maryland, also she is a Graduate research Assitant from University of Maryland College Park and Graduate Teaching Assitant from University of Maryland. Working on improving the weather forecasts after completing Phd in Atmospheric and Oceanic Sciences",University corporation for Atmospheric Research,Associate Scientist,2012,Bachelor of Technology - B.Tech.,United States,Civil Engineering,Research,2,0,1,0
173,Hostel 13,"I do research and documentation for an organization based in Tumkuru, Karnataka working towards eradication of the practice of manual scavenging",Thamate (NGO),Researcher,2007,Bachelor of Technology - B.Tech.,India,Chemical Engineering,Research,1,0,1,0
174,Hostel 2,"Presently working in NGO sector for rural development and education. Over 22 years in Resistance welding systems. Over 40 years in mechanical design. Worked with Godrej & Boyce, Klaas Equipment, retd. as GM operations at Mechelonic Engineers",Vigyan Ashram,Retired as GM(Ops),1974,Bachelor of Technology - B.Tech.,India,Mechanical Engineering,Other,4,0,1,0
175,Hostel 3,"Retired after serving Nonferrous,Iron & Steel,Cement industries. Associated with setting up of Zinc industry,Three Major Steel Plants and 1 Slag based Cement plant in the country. Actively looked after CSR n Sustainability issues. Presently Independent director.",JSW GROUP,INDEPENDENT DIRECTOR,1962,Bachelor of Technology - B.Tech.,India,Metallurgical Engineering & Materials Science,Management,2,0,1,0
176,Hostel 5,"Transportation Professional with wide exposure to public and private sector. Have handled projects from inception stage to completion. Presently heading a multidisciplinary team to deliver infrastructure projects such as township infrastructure, metro viaducts & stations, traffic and transportation studies and road projects.",GMD CONSULTANTS,MANAGING DIRECTOR,1991,Master of Technology - M.Tech.,India,Civil Engineering,Core engineering,2,0,1,0
177,Hostel 9,I am working in the Nano-electronics and quantum standards research field for last 9 years at CSIR-NPL in Delhi. Before that I did my PhD in US and worked in R&D in Intel Corporation in US.,CSIR-National Physical Laboratory,Senior Scientist,2005,Other,India,Chemistry,Research,1,0,1,0
178,Hostel 3,"I work as an empirical social scientist, trying to understand how people make decisions, and how we can influence that decision making to improve social welfare.","Centre for Social and Behaviour Change, Ashoka University",Behaviour Data Team,2017,Bachelor of Technology - B.Tech.,India,Chemical Engineering,Research,1,0,1,0
179,Hostel 7,"Post graduating, I worked with Citi for around 3 years in product management and technology. Currently, I am doing MBA at IIM Calcutta. I also run a startup-business blog.",IIM Culcutta,Student,2017,Bachelor of Technology - B.Tech.,India,Chemical Engineering,Finance,2,0,1,0
180,Hostel 3,"Ex-Manager at Deloitte Consulting. Extensive experience in assisting clients with assessing, selecting and implementing complex business applications, designing Pricing Strategies, conducting TPA assessments, providing execution support, and measurement & reporting. He also has experience in market entry and go-to-market strategies, as well as program management operations for telecom deployments and SaaS implementations.",BCG,Project Lead,2010,Dual Degree - B. Tech. & M. Tech.,India,Civil Engineering,Strategy consulting,2,0,1,0
181,Hostel 8,"Works in Designing and Developing Solutions for Energy, Automobile, and Process industries with experience in New Product Development, Technology and Innovation Management, Project Management",Forbes Marshall,Principal Lead,2008,Master of Technology - M.Tech.,India,Mechanical Engineering,Research,2,0,1,0
182,Hostel 11,"Scientist in Central Drug Research Institute.Has done commendable work in academic and industrial research. Academic and Industrial Research and expertise in organic synthesis, synthetic organic chemistry, medicinal and pharmaceutical chemistry",CENTRAL DRUG RESEARCH INSTITUTE,PRINCIPAL SCIENTIST,2006,Doctor of Philosophy - Ph.D. / D.Phil.,India,Chemistry,Research,2,0,1,0
183,Hostel 3,"IOT, Control & communication, connected healthcare, New business models and paradigms such as 'Comfort as a service' and how to enable these models. Ecological restoration and Natural resource development and management . Energy & Sustainability",1. Trans Vitals 2. The Ecological Society,"Co-Founder & Director, Trustee",1984,Bachelor of Technology - B.Tech.,India,Chemical Engineering,Strategy consulting,1,0,1,0
184,Hostel 8,"Manage Honeywell's Asset Performance Management software product.Manage a team in R&D to conduct research on steam products, develop them and release in the market; Served as Technical Consultant:U.S. Air Force",Honeywell,Senior Offering Manager,2000,Bachelor of Technology - B.Tech.,India,Aerospace Engineering,Analytics,2,0,1,0
185,Hostel 4,"Ex-Investment Banking Analyst at Credit Suisse Securities(help corporates raise money via debt, IPO, QIP etc.).Former Bussiness analyst in Fractal Analytics.Has done Masters in international management form CEMS and MBA from IIM-Calcutta.",Goldman Sachs,Associate,2014,Bachelor of Technology - B.Tech.,India,Civil Engineering,Finance,2,0,1,0
186,Hostel 7,"Founder of Spirituals, TEDx Speaker, Life coach and Resident Monk at ISKCON Chowpatty, Conducts highly motivating courses such as 'Agents of Change'",ISKCON,Head,2003,Bachelor of Technology - B.Tech.,India,Physics,Other,4,0,1,0
187,Hostel 4,"I'm an experienced energy sector executive and entrepreneur, having worked across UK & Europe, North & Latin America, Middle East, India and East Asia over the past 25 years. I design integrated clean energy solutions for Industrial and Corporate clients.",Feyn Partners,Founder and President,1995,Master of Technology - M.Tech.,France,Chemical Engineering,Other,1,0,1,0
188,Hostel 13,"Directed protein evolution, RNA networks, Droplet microfluidics, Lithography, Microfabrication Origin of Life, Also was Postdoctoral Fellow at University of Heidelberg Experimentalist interested in Origins of Life (OoL) problems. Work revolves around studying RNA catalysisand chemical self-replicating systems using interdisciplinary and high throughput approaches.",NCBS,Campus Fellow,2008,Master of Science - M.Sc. / S.M.,India,Biosciences & Bioengineering,Research,2,0,1,0
189,Hostel 13,"Primarily worked in Credit Risk Management which involved bank-wide Model Governance, region-wide Basel IRB project management & implementation, IRB model & scorecard development, Data Visualization.",HSBC GR,Vice President,2004,Master of Science - M.Sc. / S.M.,India,Mathematics,Analytics,1,0,1,0
190,Hostel 1,"Over the past 32 years I have engaged in Research, Innovation & Path-finding, Product Development, Solution Engineering, Technology Management, Strategy and Organizational Leadership at national and global levels, across several domains of technology and industries.",Ubiqare Health Private Limited,Co-Founder Director,1985,Master of Technology - M.Tech.,India,Electrical Engineering,Research,2,0,1,0
191,Hostel 10,"A marketer with experience in top 3 FMCG of the country - HUL, P&G and Nestle. Currently working as a project sales manager and have previously worked with brand management team ( particularly e-commerce) of Maggi.",Nestle,Project Sales Manager,2018,Bachelor of Technology - B.Tech.,India,Mechanical Engineering,Management,2,0,1,0
192,Hostel 11,"18 years experience with Microsoft, shipping multiple products from Windows to Bing. Currently working as a freelancer in MUST research academy. Working on cutting edge deep learning/machine learning problems since the last 5 years.",MUST Research Academy,Principal Data Scientist,2003,Master of Technology - M.Tech.,India,Computer Science & Engineering,Analytics,3,0,1,0
193,Hostel 6,"Software development for mobile packet core network (Mobility gateway for 3G/4G).currently senior software engineer art Cisco systems. Programming Languages: 
 C, Core Java, J2EE, PL/SQL,",Cisco Systems,Software Engineer,2009,Master of Technology - M.Tech.,India,Electrical Engineering,Core engineering,1,0,1,0
194,Hostel 1,"30 Year experience on Materials Science, Civil and Environmental engg, Natural Resource Management, Industrial and Agro Waste Management, Alternative Building Materials",CSIR-AMPRI,SENIOR PRINCIPAL SCIENTIST,2007,Doctor of Philosophy - Ph.D. / D.Phil.,India,Centre for Environmental Science & Engineering - CESE,Research,4,0,1,0
